{
  "schema_version": "1.0",
  "cve_ids": [
    "CVE-2023-4966"
  ],
  "affected": [
    {
      "vendor": "Citrix",
      "product": "NetScaler ADC",
      "version_scheme": "dotted",
      "ranges": [
        {
          "introduced": "14.1",
          "fixed": "14.1-8.50",
          "last_affected": null,
          "branch": null
        },
        {
          "introduced": "13.1",
          "fixed": "13.1-49.15",
          "last_affected": null,
          "branch": null
        },
        {
          "introduced": "13.0",
          "fixed": "13.0-92.19",
          "last_affected": null,
          "branch": null
        },
        {
          "introduced": "12.1",
          "fixed": null,
          "last_affected": null,
          "branch": "12.1"
        }
      ],
      "versions": [],
      "conditions": [
        "configured as a Gateway (VPN virtual server, ICA Proxy, CVPN, RDP Proxy) or as an AAA virtual server"
      ],
      "evidence": [
        "NetScaler ADC and NetScaler Gateway 14.1 before 14.1-8.50",
        "NetScaler ADC and NetScaler Gateway 13.1 before 13.1-49.15",
        "NetScaler ADC and NetScaler Gateway 13.0 before 13.0-92.19",
        "NetScaler ADC and NetScaler Gateway version 12.1 is End-of-Life (EOL) and is vulnerable",
        "the appliance must be configured as a Gateway (VPN virtual server, ICA Proxy, CVPN, RDP Proxy) or as an AAA virtual server"
      ]
    },
    {
      "vendor": "Citrix",
      "product": "NetScaler Gateway",
      "version_scheme": "dotted",
      "ranges": [
        {
          "introduced": "14.1",
          "fixed": "14.1-8.50",
          "last_affected": null,
          "branch": null
        },
        {
          "introduced": "13.1",
          "fixed": "13.1-49.15",
          "last_affected": null,
          "branch": null
        },
        {
          "introduced": "13.0",
          "fixed": "13.0-92.19",
          "last_affected": null,
          "branch": null
        },
        {
          "introduced": "12.1",
          "fixed": null,
          "last_affected": null,
          "branch": "12.1"
        }
      ],
      "versions": [],
      "conditions": [
        "configured as a Gateway (VPN virtual server, ICA Proxy, CVPN, RDP Proxy) or as an AAA virtual server"
      ],
      "evidence": [
        "NetScaler ADC and NetScaler Gateway 14.1 before 14.1-8.50",
        "NetScaler ADC and NetScaler Gateway 13.1 before 13.1-49.15",
        "NetScaler ADC and NetScaler Gateway 13.0 before 13.0-92.19",
        "NetScaler ADC and NetScaler Gateway version 12.1 is End-of-Life (EOL) and is vulnerable",
        "the appliance must be configured as a Gateway (VPN virtual server, ICA Proxy, CVPN, RDP Proxy) or as an AAA virtual server"
      ]
    },
    {
      "vendor": "Citrix",
      "product": "NetScaler ADC 13.1-FIPS",
      "version_scheme": "dotted",
      "ranges": [
        {
          "introduced": "13.1",
          "fixed": "13.1-37.164",
          "last_affected": null,
          "branch": null
        }
      ],
      "versions": [],
      "conditions": [
        "configured as a Gateway (VPN virtual server, ICA Proxy, CVPN, RDP Proxy) or as an AAA virtual server"
      ],
      "evidence": [
        "NetScaler ADC 13.1-FIPS before 13.1-37.164"
      ]
    },
    {
      "vendor": "Citrix",
      "product": "NetScaler ADC 12.1-FIPS",
      "version_scheme": "dotted",
      "ranges": [
        {
          "introduced": "12.1",
          "fixed": "12.1-55.300",
          "last_affected": null,
          "branch": null
        }
      ],
      "versions": [],
      "conditions": [
        "configured as a Gateway (VPN virtual server, ICA Proxy, CVPN, RDP Proxy) or as an AAA virtual server"
      ],
      "evidence": [
        "NetScaler ADC 12.1-FIPS before 12.1-55.300"
      ]
    },
    {
      "vendor": "Citrix",
      "product": "NetScaler ADC 12.1-NDcPP",
      "version_scheme": "dotted",
      "ranges": [
        {
          "introduced": "12.1",
          "fixed": "12.1-55.300",
          "last_affected": null,
          "branch": null
        }
      ],
      "versions": [],
      "conditions": [
        "configured as a Gateway (VPN virtual server, ICA Proxy, CVPN, RDP Proxy) or as an AAA virtual server"
      ],
      "evidence": [
        "NetScaler ADC 12.1-NDcPP before 12.1-55.300"
      ]
    }
  ],
  "not_affected": [
    {
      "vendor": "Citrix",
      "product": "Citrix-managed cloud services",
      "evidence": [
        "Customers using Citrix-managed cloud services do not need to take any action."
      ]
    }
  ],
  "extraction_notes": [
    "12.1 is end-of-life with no fix, modeled as an unbounded range confined to branch 12.1.",
    "FIPS and NDcPP editions have their own build lines and are separate products."
  ]
}