{
  "schema_version": "1.0",
  "cve_ids": [
    "CVE-2023-34362"
  ],
  "affected": [
    {
      "vendor": "Progress",
      "product": "MOVEit Transfer",
      "version_scheme": "dotted",
      "ranges": [
        {
          "introduced": "0",
          "fixed": "2021.0.6",
          "last_affected": null,
          "branch": null
        },
        {
          "introduced": "2021.1",
          "fixed": "2021.1.4",
          "last_affected": null,
          "branch": null
        },
        {
          "introduced": "2022.0",
          "fixed": "2022.0.4",
          "last_affected": null,
          "branch": null
        },
        {
          "introduced": "2022.1",
          "fixed": "2022.1.5",
          "last_affected": null,
          "branch": null
        },
        {
          "introduced": "2023.0",
          "fixed": "2023.0.1",
          "last_affected": null,
          "branch": null
        }
      ],
      "versions": [],
      "conditions": [],
      "evidence": [
        "MOVEit Transfer before 2021.0.6 (13.0.6), 2021.1.4 (13.1.4), 2022.0.4 (14.0.4), 2022.1.5 (14.1.5), and 2023.0.1 (15.0.1)",
        "All versions released before these five fixed versions, including older unsupported versions such as 2020.0 and 2019x, are affected"
      ]
    }
  ],
  "not_affected": [],
  "extraction_notes": [
    "The vendor uses two numbering schemes (2021.0.6 = 13.0.6). Ranges use the year-based names; assets fingerprinted with the legacy numbers must be translated before matching."
  ]
}