{
  "schema_version": "1.0",
  "cve_ids": [
    "CVE-2024-3400"
  ],
  "affected": [
    {
      "vendor": "Palo Alto Networks",
      "product": "PAN-OS",
      "version_scheme": "dotted",
      "ranges": [
        {
          "introduced": "10.2",
          "fixed": "10.2.9-h1",
          "last_affected": null,
          "branch": null
        },
        {
          "introduced": "11.0",
          "fixed": "11.0.4-h1",
          "last_affected": null,
          "branch": null
        },
        {
          "introduced": "11.1",
          "fixed": "11.1.2-h3",
          "last_affected": null,
          "branch": null
        }
      ],
      "versions": [],
      "conditions": [
        "GlobalProtect gateway or GlobalProtect portal (or both) configured"
      ],
      "evidence": [
        "The issue is fixed in PAN-OS 10.2.9-h1, PAN-OS 11.0.4-h1, PAN-OS 11.1.2-h3, and all later PAN-OS versions.",
        "this issue applies only to PAN-OS 10.2, PAN-OS 11.0, and PAN-OS 11.1 firewalls that have a GlobalProtect gateway or GlobalProtect portal (or both) configured"
      ]
    }
  ],
  "not_affected": [
    {
      "vendor": "Palo Alto Networks",
      "product": "Cloud NGFW",
      "evidence": [
        "Cloud NGFW, Panorama appliances, and Prisma Access are not impacted by this vulnerability."
      ]
    },
    {
      "vendor": "Palo Alto Networks",
      "product": "Panorama",
      "evidence": [
        "Cloud NGFW, Panorama appliances, and Prisma Access are not impacted by this vulnerability."
      ]
    },
    {
      "vendor": "Palo Alto Networks",
      "product": "Prisma Access",
      "evidence": [
        "Cloud NGFW, Panorama appliances, and Prisma Access are not impacted by this vulnerability."
      ]
    }
  ],
  "extraction_notes": []
}