{
  "schema_version": "1.0",
  "cve_ids": [
    "CVE-2024-3400"
  ],
  "affected": [
    {
      "vendor": "Palo Alto Networks",
      "product": "PAN-OS",
      "version_scheme": "dotted",
      "ranges": [
        {
          "introduced": "11.1.0",
          "fixed": "11.1.0-h3",
          "last_affected": null,
          "branch": null
        },
        {
          "introduced": "11.1.1",
          "fixed": "11.1.1-h1",
          "last_affected": null,
          "branch": null
        },
        {
          "introduced": "11.1.2",
          "fixed": "11.1.2-h3",
          "last_affected": null,
          "branch": null
        },
        {
          "introduced": "11.0.0",
          "fixed": "11.0.0-h3",
          "last_affected": null,
          "branch": null
        },
        {
          "introduced": "11.0.1",
          "fixed": "11.0.1-h4",
          "last_affected": null,
          "branch": null
        },
        {
          "introduced": "11.0.2",
          "fixed": "11.0.2-h4",
          "last_affected": null,
          "branch": null
        },
        {
          "introduced": "11.0.3",
          "fixed": "11.0.3-h10",
          "last_affected": null,
          "branch": null
        },
        {
          "introduced": "11.0.4",
          "fixed": "11.0.4-h1",
          "last_affected": null,
          "branch": null
        },
        {
          "introduced": "10.2.0",
          "fixed": "10.2.0-h3",
          "last_affected": null,
          "branch": null
        },
        {
          "introduced": "10.2.1",
          "fixed": "10.2.1-h2",
          "last_affected": null,
          "branch": null
        },
        {
          "introduced": "10.2.2",
          "fixed": "10.2.2-h5",
          "last_affected": null,
          "branch": null
        },
        {
          "introduced": "10.2.3",
          "fixed": "10.2.3-h13",
          "last_affected": null,
          "branch": null
        },
        {
          "introduced": "10.2.4",
          "fixed": "10.2.4-h16",
          "last_affected": null,
          "branch": null
        },
        {
          "introduced": "10.2.5",
          "fixed": "10.2.5-h6",
          "last_affected": null,
          "branch": null
        },
        {
          "introduced": "10.2.6",
          "fixed": "10.2.6-h3",
          "last_affected": null,
          "branch": null
        },
        {
          "introduced": "10.2.7",
          "fixed": "10.2.7-h8",
          "last_affected": null,
          "branch": null
        },
        {
          "introduced": "10.2.8",
          "fixed": "10.2.8-h3",
          "last_affected": null,
          "branch": null
        },
        {
          "introduced": "10.2.9",
          "fixed": "10.2.9-h1",
          "last_affected": null,
          "branch": null
        }
      ],
      "versions": [],
      "conditions": [
        "GlobalProtect gateway or GlobalProtect portal (or both) configured"
      ],
      "evidence": [
        "PAN-OS 11.1 | < 11.1.0-h3, < 11.1.1-h1, < 11.1.2-h3",
        "PAN-OS 11.0 | < 11.0.0-h3, < 11.0.1-h4, < 11.0.2-h4, < 11.0.3-h10, < 11.0.4-h1",
        "PAN-OS 10.2 | < 10.2.0-h3, < 10.2.1-h2, < 10.2.2-h5, < 10.2.3-h13, < 10.2.4-h16, < 10.2.5-h6, < 10.2.6-h3, < 10.2.7-h8, < 10.2.8-h3, < 10.2.9-h1",
        "this issue applies only to PAN-OS 10.2, PAN-OS 11.0, and PAN-OS 11.1 firewalls that have a GlobalProtect gateway or GlobalProtect portal (or both) configured"
      ]
    }
  ],
  "not_affected": [
    {
      "vendor": "Palo Alto Networks",
      "product": "Cloud NGFW",
      "evidence": [
        "Cloud NGFW, Panorama appliances, and Prisma Access are not impacted by this vulnerability."
      ]
    },
    {
      "vendor": "Palo Alto Networks",
      "product": "Panorama",
      "evidence": [
        "Cloud NGFW, Panorama appliances, and Prisma Access are not impacted by this vulnerability."
      ]
    },
    {
      "vendor": "Palo Alto Networks",
      "product": "Prisma Access",
      "evidence": [
        "Cloud NGFW, Panorama appliances, and Prisma Access are not impacted by this vulnerability."
      ]
    }
  ],
  "extraction_notes": [
    "Each PAN-OS maintenance release has its own hotfix fix; ranges are per maintenance release so patched hotfix builds are not flagged."
  ]
}